{
  "snapshot_id": "snap-v1-0001",
  "topology_version": "topology-checkout-v1",
  "window_start": "2026-03-22T00:00:00Z",
  "window_end": "2026-03-22T00:05:00Z",
  "ingest": {
    "spans": 24,
    "traces": 6,
    "dropped_spans": 0,
    "late_spans": 0
  },
  "counts": {
    "services": 3,
    "edges": 2,
    "endpoints": 2
  },
  "coverage": {
    "confidence": 0.92,
    "service_support_min": 1,
    "edge_support_min": 1,
    "endpoint_support_min": 1
  },
  "sources": [
    {
      "type": "traces",
      "connector": "trace_file",
      "ref": "bering://fixtures/checkout-v1",
      "observations": 24
    }
  ],
  "diff": {
    "added_services": 3,
    "removed_services": 0,
    "changed_services": 0,
    "added_edges": 2,
    "removed_edges": 0,
    "changed_edges": 0,
    "added_endpoints": 2,
    "removed_endpoints": 0,
    "changed_endpoints": 0
  },
  "discovery": {
    "services": [
      {
        "id": "gateway",
        "name": "gateway",
        "replicas": 1,
        "support": {
          "observations": 6,
          "trace_count": 6
        },
        "metadata": {
          "labels": {
            "team": "edge"
          }
        }
      },
      {
        "id": "checkout",
        "name": "checkout",
        "replicas": 2,
        "support": {
          "observations": 6,
          "trace_count": 6
        },
        "metadata": {
          "failure_eligible": true,
          "labels": {
            "team": "commerce"
          }
        }
      },
      {
        "id": "payment",
        "name": "payment",
        "replicas": 1,
        "support": {
          "observations": 6,
          "trace_count": 6
        },
        "metadata": {
          "labels": {
            "team": "payments"
          }
        }
      }
    ],
    "edges": [
      {
        "id": "gateway|checkout|sync|true",
        "from": "gateway",
        "to": "checkout",
        "kind": "sync",
        "blocking": true,
        "support": {
          "observations": 6,
          "trace_count": 6
        }
      },
      {
        "id": "checkout|payment|sync|true",
        "from": "checkout",
        "to": "payment",
        "kind": "sync",
        "blocking": true,
        "support": {
          "observations": 6,
          "trace_count": 6
        }
      }
    ],
    "endpoints": [
      {
        "id": "gateway:POST /checkout",
        "entry_service": "gateway",
        "method": "POST",
        "path": "/checkout",
        "support": {
          "observations": 6,
          "trace_count": 6
        },
        "metadata": {
          "weight": 0.8
        }
      },
      {
        "id": "gateway:GET /explicit",
        "entry_service": "gateway",
        "method": "GET",
        "path": "/explicit",
        "support": {
          "observations": 6,
          "trace_count": 6
        },
        "metadata": {
          "predicate_ref": "explicit.flow",
          "weight": 0.2
        }
      }
    ]
  },
  "model": {
    "services": [
      {
        "id": "gateway",
        "name": "gateway",
        "replicas": 1
      },
      {
        "id": "checkout",
        "name": "checkout",
        "replicas": 2
      },
      {
        "id": "payment",
        "name": "payment",
        "replicas": 1
      }
    ],
    "edges": [
      {
        "from": "gateway",
        "to": "checkout",
        "kind": "sync",
        "blocking": true
      },
      {
        "from": "checkout",
        "to": "payment",
        "kind": "sync",
        "blocking": true
      }
    ],
    "endpoints": [
      {
        "id": "gateway:POST /checkout",
        "entry_service": "gateway",
        "success_predicate_ref": "gateway:POST /checkout"
      },
      {
        "id": "gateway:GET /explicit",
        "entry_service": "gateway",
        "success_predicate_ref": "explicit.flow"
      }
    ],
    "predicates": {
      "explicit.flow": {
        "type": "all_of",
        "services": ["gateway", "checkout", "payment"]
      }
    },
    "endpoint_weights": {
      "gateway:POST /checkout": 0.8,
      "gateway:GET /explicit": 0.2
    },
    "metadata": {
      "source_type": "bering",
      "source_ref": "bering://fixtures/checkout-v1",
      "discovered_at": "2026-03-22T00:00:00Z",
      "confidence": 0.92,
      "schema": {
        "name": "io.mb3r.bering.model",
        "version": "1.0.0",
        "uri": "https://mb3r-lab.github.io/Bering/schema/model/v1.0.0/model.schema.json",
        "digest": "sha256:272277c093f37580adcd2dded225bd37c86539d642d7910baad7e4228227d1a7"
      }
    }
  },
  "metadata": {
    "source_type": "bering",
    "source_ref": "bering://fixtures/checkout-v1",
    "emitted_at": "2026-03-22T00:05:00Z",
    "confidence": 0.92,
    "schema": {
      "name": "io.mb3r.bering.snapshot",
      "version": "1.0.0",
      "uri": "https://mb3r-lab.github.io/Bering/schema/snapshot/v1.0.0/snapshot.schema.json",
      "digest": "sha256:87e4e887ed4a37b72f6136e268b73552eccb92941c4de2c6f3a514dd066ea972"
    }
  }
}
